<?xml version = "1.0" encoding = "UTF-8" standalone = "yes" ?>
<!DOCTYPE process-list [
	<!ELEMENT process-list (process*)>
	<!ELEMENT process (description?, input+, output+)>
	<!ATTLIST process name CDATA #REQUIRED>
	<!ATTLIST process kWh-required CDATA #REQUIRED>
	<!ATTLIST process defaultOn (true|false) #IMPLIED>
	
	<!ELEMENT description (#PCDATA)>

	<!ELEMENT input EMPTY>
	<!ATTLIST input resource CDATA #REQUIRED>
	<!ATTLIST input rate CDATA #REQUIRED>
	<!ATTLIST input ambient (true|false) #IMPLIED>
	
	<!ELEMENT output EMPTY>
	<!ATTLIST output resource CDATA #REQUIRED>
	<!ATTLIST output rate CDATA #REQUIRED>
	<!ATTLIST output waste (true|false) #IMPLIED>
]>

<process-list>

	<!-- 
		   1 kJ = 0.2778 Wh 
		 3.6 kJ = 1 Wh
		3600 kJ = 1 kWh
	-->

	<process name="Green Polymerization of Polycarbonate Resin" kWh-required=".1" >
		<description>
		The best non-polluted method involves non-phosgene process by producing 
		diphenyl carbonate (DPC) from carbon dioxide (CO₂) and ethylene oxide (EO). 
		It avoids the use of highly toxic phosgene while utilizing EO production as 
		a raw material.
			
		This approach significantly reduces environmental and health risks, 
		generates fewer emissions, and produces water and carbon monoxide as 
		by-products instead of hazardous waste.

		The process is considered more environmentally friendly, with lower 
		acidification potential and reduced energy consumption compared to 
		the phosgene method.
			
		This represents the melt transesterification of bisphenol A (BPA) 
		with diphenyl carbonate (DPC) to form polycarbonate and phenol. 
		
		The DPC is synthesized from CO₂ and ethylene oxide, avoiding 
		toxic phosgene.
		
		Phenol (also known as carbolic acid, phenolic acid, or benzenol) is 
		an aromatic organic compound with the molecular formula C6H5OH
		(MW: 94.11 g/mol)
		
		A newer, direct "green" method synthesizes polycarbonate diols from CO₂ 
		and diols, with the general reaction: 
		n HO-R-OH + n CO₂ → [O-R-O-CO]ₙ + n H₂O where R is an organic chain, 
		and water is the only by-product.
		
		CO₂ + 2 C₆H₅OH → C₁₃H₁₀O₃ (DPC) + H₂O

		</description>
		<!-- rate: the input/output resource rate [in kg/sol] -->
		<input resource="bisphenol-a" rate="228.29" />
		<input resource="carbon dioxide" rate="44.0" />
		<!--input resource="phenol" rate="188.22" /-->
								
		<output resource="Polycarbonate resin" rate="254.29" />
		<!--output resource="phenol" rate="188.22" /-->
		<output resource="water" rate="18.0" />
	</process>


	<process name="Insitu Epoxidation of Triglyceride" kWh-required=".1"  >
		<description>
		A greener, non-polluting method for producing epoxy resin involves using 
		epoxidized vegetable oils, such as epoxidized linseed or soybean oil, 
		instead of bisphenol-A and epichlorohydrin. 
		
		This method avoids toxic chemicals and reduces environmental impact.

		The process uses in situ epoxidation with hydrogen peroxide (H₂O₂) and a 
		catalyst (e.g., ion-exchange resin or formic acid), where double bonds 
		in triglycerides are converted to epoxide rings.
		
		Simplified Balanced Equation (using a model triglyceride with 
		three linoleic acid chains):
			
		Reactants:
			Triglyceride (e.g., linolein): C₅₇H₉₈O₆, Molar mass ≈ 875.4 g/mol
			Hydrogen peroxide (3 mol): 3 × H₂O₂, Molar mass = 3 × 34.0 = 102.0 g/mol
			
		Products:
			Epoxidized triglyceride: C₅₇H₁₀₄O₉, Molar mass ≈ 929.4 g/mol
			Water (3 mol): 3 × H₂O, Molar mass = 3 × 18.0 = 54.0 g/mol
			
		This method produces water as the only byproduct, making it significantly 
		cleaner than traditional chlorohydrin-based processes.
		
		</description>	
		<input resource="Triglyceride" rate="875.4"  />
		<input resource="Hydrogen peroxide" rate="102.0"  />
		
		<output resource="Epoxy resin" rate="929.4" />
		<output resource="Water" rate="54.0" />
	</process>
	
	<process name="Photosynthetic Conversion of CO2 to Ethylene" kWh-required="0.1" >
		<description>
		The direct conversion of carbon dioxide to ethylene using photoautotrophic cyanobacteria involves an engineered 
		photosynthetic process. While natural photosynthesis produces glucose and oxygen from carbon 
		dioxide and water, the engineered system described in research allows cyanobacteria to use 
		electricity and light to convert carbon dioxide into ethylene (C₂H₄) or acetate.
		
 		The specific chemical reaction for ethylene production is not a standard natural photosynthetic
 		equation but results from a modified pathway.
 		
	    2CO2 + 4H+ + 2e- + light energy -> C2H4 + 2O2 
	     g/mol :                 88 + 4 -> 2*12+ 4 + 2 * 32 
	                                         28  + 64
	        
	    This reaction is driven by an artificial system that replaces photosystem II, allowing electrons 
	    from an external source (electricity) and light to power the reduction of CO₂ to ethylene via 
	    photosystem I in engineered cyanobacteria.
	    
 		This approach bypasses the inefficiencies of natural photosynthesis, such as overlapping light 
 		absorption spectra and competition between oxygen and carbon dioxide for the carbon-fixing enzyme.
	    
	    Note: it could check for solar irradiance, instead of providing artificial light that
	          uses up power.
	 
		</description>						
		<input resource="carbon dioxide" rate="88.0" ambient="true" />
		<input resource="hydrogen" rate="4.0" />
		
		<output resource="ethylene" rate="28.0" />
		<output resource="oxygen" rate="64.0" />
	</process>
	
	<process name="Glucose Fermentation" kWh-required="0.0" >
		<description>
         These fermentations are brought about by strictly anaerobic bacteria.
         
         Facultative anaerobes such as members of the family Enterobacteriaceae, including Escherichia coli, Salmonella, 
         and Shigella. 
         
         Obligate anaerobes such as Clostridium, Propionibacterium, and various lactic acid bacteria.
         
         The glucose is fermented to acetate, C02 and H2 or to acetate, formate and H2:
         
	     C6H12O6 + 2H2O -> 2CH3COOH (acetic acid) + 2CO2 + 4H2
	     180 g/mol,  2*18 g/mol ->  2 * 60g/mol, 2*44 g/mol + 4 *2 g/mol
	     
	     see https://www.microbiologyresearch.org/content/journal/micro/10.1099/00221287-144-9-2377
	     
	     -215.7 kJ / mol
	     
		</description>						
		<input resource="Glucose" rate="180.0" />
		<input resource="Water" rate="36.0" />	

		<output resource="Acetic acid" rate="120.0" />
		<output resource="carbon dioxide" rate="88.0" waste="true" />
		<output resource="Hydrogen" rate="8.0" />
	</process> <!--"Glucose Fermentation"-->

	<process name="Photo Fermentation by Chlorella" kWh-required="0.0" >
		<description>
                  
		 The formula given is a general representation of photofermentation, 
		 commonly associated with certain photosynthetic bacteria or microalgae,
		 potentially Chlorella vulgaris.          
				                    
	     C6H12O6 + 6H2O -> 6CO2 + 12H2
	     180 g/mol,  6*18 g/mol ->  6*44 g/mol + 12*2 g/mol
	     
		</description>						
		<input resource="Glucose" rate="180.0" />
		<input resource="water" rate="108.0" />	

		<output resource="Carbon dioxide" rate="264.0" waste="true" />
		<output resource="Hydrogen" rate="24.0" />
	</process>

	<process name="Cellulolysis of Fiber into Glucose" kWh-required="0.0" >
		<description>
		 The chemical process for converting fiber into glucose involves breaking down 
		 the complex carbohydrate structures of fiber into simpler sugar molecules.	
	     
	     Cellulose (C6H10O5)n 162.14 g/mol
	     
	     Glucose C6H12O6 
	     
	     The term "fibres" mostly means cellulose, which is a polysaccharide molecule, 
	     i.e. it is composed of hundreds or thousands of glucose molecules connected to 
	     each other by glycosidic bonds.
	     
	     Cow has intestinal flora that contain bacterias that can break down β(1→4) bonds,
	     live on the energy these bonds contain, and as a consequence provide the host 
	     with the resulting glucose.

		 Cellulase is a group of enzymes (amylase, lipase and protease) that break down 
		 cellulose into its component glucose molecules.

		</description>						
		<input resource="Crop waste" rate="162.0" />
		<input resource="Water" rate="18.0" />
		
		<output resource="Glucose" rate="180.0" />

	</process> <!--"Cellulolysis of Fiber into Glucose"-->

	<process name="Methanogenesis by Archaea" kWh-required="0.0" >
		<description>
		Methanogenesis is the only way that methanogenic archaea (Methanoarchaea) can obtain energy 
		for growth and these are the only organisms known to produce methane as a catabolic end product.
		
	     CH3OH + H2 -> CH4 + H2O 
	     g/mol : 32 + 2 -> 16 + 18 
	     
	     see https://www.microbiologyresearch.org/content/journal/micro/10.1099/00221287-144-9-2377
	     
	     -112.5 kJ / mol
	     
		</description>						
		<input resource="Methanol" rate="320.0" />
		<input resource="Hydrogen" rate="20.0" />	

		<output resource="Methane" rate="160.0" />
		<output resource="Water" rate="180.0" />
	</process>

	<process name="Oxidation of Methane into Methanol by Methanotrophs" kWh-required="0.0" >
		<description>

		 Naturally occurring methane-oxidizing microorganisms are known as 
		 methanotrophs. 
		 
		 Methanotrophs can be either bacteria or archaea. Which methanotroph species is 
		 present is mainly determined by the availability of electron acceptors. 
		 
		 Many types of methane oxidizing bacteria (MOB) are known.
		 	 		 
		 Some methanotrophs possess an added advantage of sequestering CO2 as 
		 substrate for enzymatic hydrogenation into methanol, and thereby qualify
		 as suitable candidates for CO2 sequestration.
		 
		 Owing to their ability to utilize methane as the source of carbon and energy, 
		 methanotrophs serve as excellent candidates for methane sequestration. 

		 The use of microorganisms as biocatalysts for the sequestration of CH4 
		 and CO2 is an attractive alternative as they require milder operating 
		 conditions and do not release any toxic by-products. 

		 Assuming the following balanced equation for this 'hypothetical' reaction : 
		 3 CH4 + CO2 + 2 H2O -> Ch3OH
		 
		   48g   44g   36g   -> 128g
		  
		 See 
		 1. https://en.wikipedia.org/wiki/Methanotroph
		 2. https://www.frontiersin.org/journals/microbiology/articles/10.3389/fmicb.2021.636486/full
		 3. https://www.frontiersin.org/journals/microbiology/articles/10.3389/fmicb.2021.678057/full
		 
		</description>						
		<input resource="Methane" rate="48.0" />
		<input resource="Carbon dioxide" rate="44.0" ambient="true" />
		<input resource="Water" rate="36.0" />
		
		<output resource="Methanol" rate="128.0" />

	</process> <!-- "Oxidation of Methane into Methanol by Methanotrophs" -->
		
	<process name="Sabatier RWGS Reactor" kWh-required="0.0" >
	<description> 
	 A. Sabatier process :

		CO2 + 4H2 -> CH4 + 2H2O, exothermic heat = -165 kJ/mol

		CO2 : 44 g/mol
		4H2 : 8 g/mol
		CH4 : 16 g/mol
		2H2O : 36 g/mol

		B. The Reverse Water Gas Shift (RWGS) process is a
		candidate technology for water and oxygen production
		on Mars. RWGS uses carbon dioxide and hydrogen as
		reactants to produce oxygen and carbon monoxide with a
		copper on alumina catalyst, or in the precsence of an
		iron-chrome catalyst.

		CO2 + H2 = CO + H2O

		Because the RWGS reaction is only mildly endothermic (at 400 deg C,
		9 kcal/mole for RWGS compared to 57 kcal/mole for water electrolysis),
		it's better than just having the water electrolysis alone.

		Moreover, since the thermal power required by the RWGS is less than that
		produced by the Sabatier reactor and their operating temperatures are comparable, a
		Sabatier reactor can be used to provide the heat required to drive the RWGS
		reactor.
	
	 B. Sabatier with Reverse Water Gas Shift (RWGS) :

		3CO2 + 6H2 -> CH4 + 2CO + 4H2O, exothermic heat = -83 kJ/mol

		3CO2 : 132 g/mol
		6H2 : 12 g/mol
		CH4 : 16 g/mol
		2CO : 56 g/mol
		4H2O : 72 g/mol

		The primary disadvantage of the Sabatier process is that twice
		as much hydrogen is consumed as can be recovered by the
		electrolysis of the produced water.

		In one in-situ propellant prooduction system (ISPP), it uses
		Sabatier and Reverse Water Gas Shift (RWGS) to convert H2
		and CO2 into OX and CH4 (with CO as waste).  It requires 470 W
		to produce 1 kg of propellant per sol, per Zurin's paper on
		"Integrated Mars In-Situ Propellant Production System.

	</description>
	<!-- rate: the input/output resource rate [in kg/sol] -->
		<input resource="carbon dioxide" rate="660" ambient="true" />
		<input resource="hydrogen" rate="60" />
		
		<output resource="methane" rate="80" />
		<output resource="carbon monoxide" rate="280" waste="false" />
		<output resource="water" rate="360" />
	</process> <!-- "Sabatier RWGS Reactor" -->

	<process name="CO Methanation" kWh-required="0.0" >
	<description> 
	
	A related variant is CO methanation, which proceeds according to:
	
		CO + 3H2 -> CH4 + 2H2O, exothermic heat = -165 kJ/mol

		CO : 28 g/mol
		3H2 : 6 g/mol
		CH4 : 16 g/mol
		H2O : 18 g/mol

	</description>
		<input resource="carbon monoxide" rate="560" ambient="false" />
		<input resource="hydrogen" rate="120" />
		
		<output resource="methane" rate="320" />
		<output resource="water" rate="360" />
	</process> <!-- "CO Methanation" -->

		
	<process name="Continuous Bosch Reactor (C-Bosch)" kWh-required="0.01" >
		<description> 						
		In recent years, under the SpaceCraft Oxygen Recovery (SCOR) program, 
		NASA seeks to increase oxygen recovery beyond the state of the art (42%) 
		to at least 75% and approaching 100%.
				
		1. Space oxygen recovery technologies implemented include carbon formation reactors (CFR) 
		and methane plasma pyrolysis assembly (PPA) reactors. 
				
		2. The Continuous Bosch Reactor (C-Bosch) - aims to produce water and 
		elemental carbon from hydrogen and carbon dioxide. Highly efficient for 
		utilization of hydrogen, it would replace the current state-of-the-art 
		Sabatier reactor.
		
		3. Hydrogen Recovery by Carbon Vapor Deposition aims to do what Sabatier
		lacks, namely, recovering hydrogen. The Sabatier is limited in its ability 
		to recover oxygen from carbon dioxide due to an insufficient amount of hydrogen. 
		
		The Sabatier requires additional hydrogen due to the production of the 
		byproduct methane. If hydrogen can be recovered from this byproduct, it 
		can be sent back to the Sabatier to react with carbon dioxide and produce 
		additional oxygen.
		
		- A high-temperature solid oxide co-electrolyzer (SOCE) is to be combined 
		with a carbon formation reactor.
		
		C-Bosch Reactor reduces CO2 to C and H20 using H2: 
					CO2 + 2H2 ->  C + 2H2O
					44g   4g     12g  36g
					
				1.	CO2 + H2 -> CO + H2O
					44g   2g     28g  18g
				2.  CO + H2  -> C + H2O
					28g   2g    12g  18g
											
	
		While the core reaction is exothermic, net energy input is still required to:

		1. Heat reactants to reaction temperature,
		2. Power gas compression and recycling,
		3. Run auxiliary systems (e.g., CO₂ adsorption pumps, water electrolysis).
		
		</description> 
		<!-- Note: Set ambient to false to reduce the probability of 
				overusing hydrogen to produce methanol -->
		<input resource="carbon dioxide" rate="44.0" ambient="true" />
		<input resource="hydrogen" rate="4.0"  />
		
		<output resource="water" rate="36.0"  />
		<output resource="carbon" rate="12.0"  />
		
	</process> <!-- "Continuous Bosch Reactor (C-Bosch)" -->
	
	<process name="Carbon Monoxide Hydrogenation" kWh-required="0.01" >
		<description> 						
        The carbon monoxide hydrogenation step in the Bosch process is
        exothermic. It releases energy rather than requiring a net input.	
        
				  CO + H2  -> C + H2O
				  28g   2g    12g  18g					
		This reaction releases approximately 2.3 × 10³ joules per gram 
		of CO₂ reacted at 650 °C
		
		However, initial energy input is still required to:
		1. Heat the reactor to 450–730 °C,
		2. Maintain reaction conditions,
		3. Overcome activation energy barriers.

		While the reaction itself produces heat, the high operating 
		temperatures and catalyst maintenance (due to carbon fouling) 
		make the process energy-intensive in practice.
		
		</description> 
		<input resource="carbon monoxide" rate="140.0" ambient="false" />
		<input resource="hydrogen" rate="10.0"  />
		
		<output resource="water" rate="90.0"  />
		<output resource="carbon" rate="60.0"  />
		
	</process> <!-- "Carbon Monoxide Hydrogenation" -->
		
	<process name="Plasma Pyrolysis Assembly (PPA) Reactor" kWh-required="0.01" >
		<description>
			By partial pyrolysis in microwave generated plasma, methane is converted to 
			hydrogen and acetylene:					  
						2CH4 -> 3H2 + C2H2
						32g     6g    26g
						
				3C2H4 +	2CH4 -> 3H2 + C2H2 + 2C3H6
				 3*28g	32g     6g    26g	  2*42g
						
			Hydrogen separation carried out with electrochemical cell stack. 
			
			H2 recovered from CH4 and sent to Sabatier to recover additional O2 from CO2
			- ~50% O2 recovery with Sabatier
			- Potentially >85% total O2 recovery with PPA
			- Acetylene C2H2 and propylene C3H6 are formed from ethylene C2H4 via radical 
			  chain dehydrogenation and radical chain methylation reactions, respectively.  
			- Acetylene must be removed from PPA outlet stream before hydrogen 
			  can be sent to Sabatier

			References: 
			1. https://pubs.acs.org/doi/10.1021/acs.iecr.1c01679  
		</description> 
		<input resource="methane" rate="32.0" />
		<input resource="ethylene" rate="84.0" />
		
		<output resource="hydrogen" rate="6.0" />
		<output resource="acetylene" rate="26.0" />
		<output resource="propylene" rate="84.0" />
	</process> <!-- "Plasma Pyrolysis Assembly (PPA) Reactor" -->

	
	<!-- Convert ethane C2H6 to ethylene C2H4 and H2 using CO2 as mild oxidation agent 
	
	C2H6 -> C2H4 + H2
	30g     28g    2g
	
	2CH4 + 0.5O2 -> C2H6 + H2O
	
	C2H6 + 0.5O2 -> C2H4 + H2O
	
	Reference : 
	1. https://www.sciencedirect.com/science/article/abs/pii/S0360319920335904
	2. https://www.sciencedirect.com/science/article/abs/pii/S0016236102000741
	-->
	
	<process name="Produce Oxygen and Acetylene with Chloride and Carbides" kWh-required="0.01" >
		<description>
			This reaction produces acetylene utilizing the electrochemical reduction
			of CO2 by high-temperature molten salts, namely chloride melts. 
			
			Acetylene is generated by the reaction between water and metal carbides, 
			which are formed by the reduction of CO2 and cations in the melts. 
			
			CO2 is first converted to metallic carbides such as CaC2 and Li2C2, 
			which deposit onto one of the electrodes during the electrochemical process.
					
			This conversion occurs within a high-temperature molten salt environment, 
			specifically a NaCl−KCl−CaCl2−CaO melt saturated with additional CaCl2, 
			where CO2 is transformed into calcium carbide (CaC2) around the cathode.
			
			The key reaction for the formation of calcium carbide from CO₂ and the 
			molten salt components is:
			
			(1) CaO + 3C + CO2 -> CaC2 + 2CO

			The first reaction occurs within the molten salt system where CO₂ is reduced, 
			and calcium carbide is selectively formed around the cathode.
			
 			The calcium carbide (CaC₂) produced is then used to generate acetylene (C₂H₂)
 			when it reacts with water:

			(2) CaC2 + 2H2O -> Ca(OH)2 + C2H2
			
			The second reaction is a well-known hydrolysis process where calcium carbide 
			reacts with water to produce calcium hydroxide and acetylene gas.
			
			The overall process, therefore, converts CO₂ and water into acetylene, with 
			the intermediate formation of calcium carbide in the molten salt environment.
			
 			The method leverages metal carbides as a pivotal point in the conversion process, 
 			with the deposited carbides subsequently reacting with water to generate acetylene gas.	
 				
			This process is more sustainable than "Plasma Pyrolysis Assembly (PPA) Reactor"
			for making Acetylene as it does not consume methane and utilizes 
			cardon dioxide and water as inputs.
	
			  2CO2 + H2O → C2H2 + 2.5O2			
			 2*44g   18g    26g   2.5*32g	
			
			Reference: 
			1. https://phys.org/news/2024-03-advancing-sustainability-carbon-dioxide-acetylene.html
			2. https://pubs.acs.org/doi/epdf/10.1021/acssuschemeng.3c08139
 
		</description> 
		<input resource="Carbon dioxide" rate="88.0" ambient="true"/>
		<!-- Assume rock salt contains CaCl2 (molecular weight : 111 g/mol)-->
		<input resource="Rock salt" rate="11.0" />
		<!-- Assume lime contains CaO (molecular weight : 56 g/mol)-->
		<input resource="lime" rate="5.6" />
		<input resource="Water" rate="18.0"  />
				
		<output resource="Acetylene" rate="26.0"  />
		<output resource="Oxygen" rate="80.0"  />
		<output resource="Rock salt" rate="11.1" />
		<output resource="lime" rate="5.6" />
		
	</process> <!--"Produce Oxygen and Acetylene with Chloride and Carbides"-->

	<process name="Selective Partial Oxidation (SPO) of Methane to Methanol" kWh-required="0.01" >
		<description>
		Requires oxidant : O2 in the presence of very small amount of H2O2. 
		Catalyst : Colloidal Au-Pd nanop-articles (3-5nm)
		
		Au-Pd catalysts form Methyl radicals, which break the C-H bond, leading to 
		successful methanol production. High selectivity of 92% 
		
		2 Ch4 + O2 -> 2 CH3OH
		32g ,  32 g , 64 g (or 58.88 at 92%)
		
		See
		1. https://pubs.acs.org/doi/suppl/10.1021/jacs.5c11683/suppl_file/ja5c11683_si_001.pdf
		2. https://pubs.acs.org/doi/10.1021/jacs.5c11683
		
		
		Alternatively, consider 
		"Direct photo-oxidation of methane to methanol over a mono-iron hydroxyl site"
		1. https://www.nature.com/articles/s41563-022-01279-1
		2. https://neutrons.ornl.gov/content/found-%E2%80%98holy-grail-catalysis%E2%80%99-%E2%80%94-turning-methane-methanol-under-ambient-conditions-using-light

		
		</description> 
		<input resource="methane" rate="32"  />
		<input resource="oxygen" rate="32"  />
		
		<output resource="methanol" rate="64"  />
	</process> <!--"Selective Partial Oxidation (SPO) of Methane to Methanol"-->
		
 <!-- 
	<process name="Catalytic Partial Oxidation of Methane (CPOM) to Produce Hydrogen" kWh-required="0.00" >
	<description>

		In partial oxidation, the methane and other hydrocarbons in natural gas react with a 
		limited amount of oxygen (typically from air) that is not enough to completely oxidize 
		the hydrocarbons to carbon dioxide and water. 
		
		This process is considered more cost-effective than SMR and Dry Reforming Methane (DMR) because it requires 
		neither catalyst nor external heat, both of which significantly contribute to the 
		operating costs.
		
		With less than the stoichiometric amount of oxygen available, the reaction products 
		contain primarily hydrogen and carbon monoxide (and nitrogen, if the reaction is 
		carried out with air rather than pure oxygen), and a relatively small amount of 
		carbon dioxide and other compounds. 
		
		Partial oxidation is an exothermic process—it gives off heat. The process is, 
		typically, much faster than steam reforming and requires a smaller reactor vessel. 
		As can be seen in chemical reactions of partial oxidation, this process initially 
		produces less hydrogen per unit of the input fuel than is obtained by steam reforming 
		of the same fuel.
		
		Among the supports, alumina (Al₂O₃) and ceria (CeO₂) have shown the best performance due 
		to their high surface area, which promotes high nickel dispersion, and the presence of 
		oxygen vacancies in CeO₂ that enhance oxygen adsorption and mobility, aiding in 
		carbon removal.
		
 		Nickel supported on lanthanum oxide (La₂O₃) also exhibits low carbon deposition, 
 		attributed to the formation of lanthanum oxycarbonate (La₂O₂CO₃), which gasifies 
 		carbon deposits.
 		
		For improved stability and activity, catalysts like Ni/MgO, where a cubic (Mg, Ni)O 
		solid solution forms, offer high stability against reduction at high temperatures.
		
		CH4 + .5O2 -> CO + 2H2 + heat  at 298K. -35 kJ/mol
		 16    16      28    4  
		 
	</description>

		<input resource="Methane" rate="160.0" />
		<input resource="Oxygen" rate="160.0"  />				
		
		<output resource="Carbon monoxide" rate="280.0" />
		<output resource="Hydrogen" rate="40.0"  />
	</process> "Catalytic Partial Oxidation of Methane (CPOM) to Produce Hydrogen" -->

 <!-- 
	<process name="Oxidative Dry Reforming of Methane (ODRM) to Produce Hydrogen" kWh-required="0.00" >
	<description>

		This process maintains high methane conversion by integrating exothermic partial oxidation of 
		methane (POM), which provides the necessary heat for the endothermic dry reforming reaction,
		thereby enabling self-heating and avoiding the need for an external energy source.
		 
		Studies have shown that catalysts like rhodium and ruthenium supported on mixed magnesium 
		and aluminum oxides achieve steady methane conversion of up to 95% under ODRM conditions, 
		with stable H₂/CO ratios close to 2, which is favorable for downstream fuel synthesis.
		
		The balanced addition of oxygen helps prevent catalyst deactivation by coke formation, 
		a common issue in pure dry reforming, while maintaining high conversion efficiency.
		
		CH4 + CO2  + .5O2 -> 2CO + 2H2 
		 16    44     16     56     4 
		 
	</description>

		<input resource="Methane" rate="160.0" />
		<input resource="Carbon dioxide" rate="440.0" />
		<input resource="Oxygen" rate="160.0"  />				
		
		<output resource="Carbon monoxide" rate="560.0" />
		<output resource="Hydrogen" rate="40.0"  />
	</process> "Oxidative Dry Reforming of Methane (ODRM) to Produce Hydrogen" -->
	
	<process name="Steam Methane Reforming (SMR)" kWh-required="0.01" >
	<description>

		Methane steam reforming (MSR) is defined as a process that reacts methane with steam 
		to produce hydrogen and carbon monoxide as a by-product, representing the most 
		cost-efficient method for hydrogen production from fossil fuels. It operates 
		at high temperatures and pressures, and is responsible for over 95% of the 
		hydrogen supply in the United States.
		
		CH4 + H2O -> CO + 2H2	Endothermic process; 800 - 900C;  at 15–50 bar, 251 kJ/mol 
		 16    18     28    4  
		 
		Water Gas Shift reaction  Exothermic reaction; -41.2 kJ/mol  
		CO + H2O -> CO2 + H2		
		28   18     44    2  


		In overall,

		CH4 + 2H2O -> CO2 + 3H2		206 kJ/mol
		 16    36      44    6  


	</description>
		<input resource="Methane" rate="160.0" />
		<input resource="Water" rate="360.0"  />				
		
		<output resource="Carbon dioxide" rate="440.0" waste="true" />
		<output resource="Hydrogen" rate="60.0"  />
	</process> <!-- "Steam Methane Reforming (SMR)" -->

	<process name="Dry Methane Reforming (DMR)" kWh-required="0.01" >
	<description>

		Dry methane reforming (DMR) or CO2 reforming is the third common form of reforming process.
		
		Optimizing DRM for lower energy consumption involves using catalysts that enable self-heating 
		(e.g., via oxidative reforming), designing highly active and stable catalysts with interfacial
		sites (e.g., Ir/CeO₂₋ₓ) or promoters (e.g., Li in Ni–Al LDH), and integrating process 
		innovations like pressurized operation and CO₂ recycling to minimize external energy demands.

		CH4 + CO2 -> 2CO + 2H2		; 247 kJ/mol
		 16   44      56    4  


	</description>
		<input resource="Methane" rate="160.0" />
		<input resource="Carbon dioxide" rate="440.0" ambient="true"  />				
		
		<output resource="Carbon monoxide" rate="560.0" waste="false"/>
		<output resource="Hydrogen" rate="40.0"  />
	</process> <!-- "Dry Methane Reforming (DMR) to Produce Hydrogen" -->


	<process name="Water-Gas Shift Reaction (WGSR)" kWh-required="0.0">
	<description>
		
		CO + H2O -> CO2 + H2 ;  Exothermic reaction; -41.2 kJ/mol
		28   18     44    2
		
		This reaction is a key step in hydrogen production, particularly 
		in conjunction with steam reforming of methane or other hydrocarbons, 
		where carbon monoxide is a primary product that is then converted to 
		hydrogen via the WGSR.
		
		The reaction is moderately exothermic and its equilibrium favors higher 
		hydrogen production at lower temperatures, leading to the use of 
		high-temperature shift (HTS) and low-temperature shift (LTS) reactors 
		in industrial applications.
		
	</description>

		<input resource="carbon monoxide" rate="280.0" ambient="false" />
		<input resource="water" rate="180.0"  />				
		
		<output resource="carbon dioxide" rate="440.0" waste="true" />
		<output resource="hydrogen" rate="20.0"  />
	</process> <!-- "Water-Gas Shift Reaction (WGSR)" -->



	<process name="Oxygen Generation System (OGS)" kWh-required="0.15625" defaultOn="true">
	<description> 
	
		Oxygen Generation System can split water into H2 and O2.
		
		1. Brine Electrolysis (Most Efficient for Liquid Water)

		This is currently considered the superior method for sites with accessible subsurface brine.
	    A new approach can produce ultrapure H2 and O2 from liquid-phase Martian regolithic brine at ∼−36 °C. 
	    
	    Utilizing aPb2Ru2O7−δ pyrochlore O2-evolution electrocatalyst and a Pt/C H2-evolution electrocatalyst, 
	    it's been demonstrated a brine electrolyzer with >25× the O2 production rate of the Mars Oxygen 
	    In Situ Re-source Utilization Experiment (MOXIE) from NASA’s Mars 2020 mission for the same input 
	    power under Martian terrestrial conditions.
	
		Mechanism: Uses specialized electrodes (e.g., lead ruthenate pyrochlore anodes) to split salty water 
		(magnesium perchlorate brine) directly at low temperatures (−36 °C) without needing energy-intensive
		heating or desalination. 
	
		Advantages: It is 25 times more energy-efficient than atmospheric CO₂ electrolysis (MOXIE) for oxygen 
		production and simultaneously yields pure hydrogen fuel.  It operates at ambient Martian temperatures, 
		saving the massive energy penalty required to heat other systems.	
		
		Ref: 